<?xml version="1.0" encoding="UTF-8"?>
<!DOCTYPE excels SYSTEM "easy-excel.dtd">
<excels>
	<!-- excel标签参看:org.easy.excel.config.ExcelDefinition,Field标签参看:org.easy.excel.config.FieldValue -->
	
	<!-- 测试使用 ,学生类-->
	<excel id="student" class="org.easy.excel.test.model.StudentModel" requiredTag="true" sheetname="测试学生列表" defaultAlign="center" sheetIndex="0">
		<field name="id" align="left" titleBgColor="dark_blue" uniformStyle="true" columnWidth="3000" titleFountColor="white" title="ID"/>
		<field name="name" title="学生姓名" uniformStyle="true"/>
		<field name="age" forceText="true" title="年龄" align="right" titleFountColor="red" titleBgColor="dark_blue" isNull="false" regex="^[1-9]\d*$" regexErrMsg="必须是数字"/>
		<field name="studentNo" title="学号" titleFountColor="blue" isNull="false" />
		<field name="createTime" forceText="true" columnWidth="4000" title="创建时间" pattern="yyyy-MM-dd"/>
		<field name="status" title="状态" titleBgColor="green" format="1:正常,0:禁用,-1:无效" />
		<!-- 创建人,可能需要查询数据库校验,这里使用自定义解析器 -->
		<field name="createUser" title="创建人"  cellValueConverter="org.easy.excel.test.converter.CreateUserCellValueConverter" otherConfig="Test动态传递的一个变量"/>
		
		<!-- 复杂对象 -->
		<field name="book.bookName" title="图书名称" columnWidth="6000"/>
		<field name="book.price" title="图书价格" columnWidth="6000" decimalFormatPattern="###,##0.00" roundingMode="up" defaultValue="0.00"/>
		<field name="book.author.authorName" title="作者名称" columnWidth="6000"/>
	</excel>
	
	<!-- 对Map的配置支持 ,class可以写成map或者hashMap都是可以的,java.util.HashMap也是没有问题的,只要是Map接口实现,带无参构造就可以配置-->
	<excel id="studentMap" class="map" requiredTag="true" sheetname="测试学生列表" defaultAlign="center" sheetIndex="0">
		<field name="id" align="left" titleBgColor="dark_blue" uniformStyle="true" columnWidth="3000" titleFountColor="white" title="ID"/>
		<field name="name" title="学生姓名" uniformStyle="true"/>
		<field name="age" title="年龄" align="right" titleFountColor="red" titleBgColor="dark_blue" isNull="false" regex="^[1-9]\d*$" regexErrMsg="必须是数字"/>
		<field name="studentNo" title="学号" titleFountColor="blue" isNull="false" />
		<field name="createTime" columnWidth="4000" title="创建时间" pattern="yyyy-MM-dd"/>
		<field name="status" title="状态" titleBgColor="green" format="1:正常,0:禁用,-1:无效" />
		<!-- 创建人,可能需要查询数据库校验,这里使用自定义解析器 -->
		<field name="createUser" title="创建人"  cellValueConverter="org.easy.excel.test.converter.CreateUserCellValueConverter" otherConfig="Test动态传递的一个变量"/>
		
		<!-- 复杂对象 -->
		<field name="book.bookName" title="图书名称" columnWidth="6000"/>
		<field name="book.price" title="图书价格" columnWidth="6000" decimalFormatPattern="###,##0.00" roundingMode="up" defaultValue="0.00"/>
		<field name="book.author.authorName" title="作者名称" columnWidth="6000"/>
	</excel>
	
	<excel id="student2" class="org.easy.excel.test.model.StudentModel">
		<field name="id" title="ID"/>
		<field name="name" title="学生姓名"/>
		<field name="age" title="年龄" isNull="false" regex="^[1-9]\d*$" regexErrMsg="必须是数字"/>
		<field name="studentNo" title="学号" isNull="false" />
		<field name="createTime" title="创建时间" pattern="yyyy-MM-dd"/>
		<field name="status" title="状态" format="1:正常,0:禁用,-1:无效" />
		<field name="createUser" title="创建人"/>
		<!-- 复杂对象 -->
		<field name="book.bookName" title="图书名称" />
		<field name="book.author.authorName" title="作者名称" isNull="false"/>
	</excel>

	
	<excel id="oneToManyModel" class="org.easy.excel.test.model.OneToManyModel">
		<field name="studentName" title="学生姓名"/>
		<!-- 复杂对象 -->
		<field name="books[0].bookName" title="图书名称1" />
		<field name="books[1].bookName" title="图书名称2" />
	</excel>

	

	
</excels>
